title,summary,authors,published,link
CPP Magnetoresistance of Magnetic Multilayers: A critical review,"We present a comprehensive review of data and analysis of Giant (G)
Magnetoresistance (MR) with Current-flow Perpendicular-to-layer-Planes (CPP-MR)
of magnetic multilayers [F/N]n (n = number of repeats) with alternating
nanoscale layers of ferromagnetic (F) and non-magnetic (N) metals. GMR, a large
change in resistance when an applied magnetic field changes the moment ordering
of adjacent F-layers from anti-parallel (AP) to parallel (P), was discovered in
1988 in the Current-flow-in-layer-Planes (CIP) geometry. The CPP-MR has two
advantages over the CIP-MR: (1) it allows more direct access to the underlying
physics; and (2) it is usually larger, which should be advantageous for
devices. When the first CPP-MR data were published in 1991, it was not clear
whether electronic transport in GMR multilayers is fully diffusive or at least
partly ballistic. It was not known whether the properties of layers and
interfaces would vary with layer thickness or number. It was not known if the
CPP-MR would be dominated by scattering within the F-metals or at the F/N
interfaces. Nothing was known about: (1) spin-flipping within F-metals,
characterized by a spin-diffusion length, l(F)sf; (2) interface specific
resistances (AR = area A times resistance R) for N1/N2 interfaces; (3)
interface specific resistances and spin-dependent scattering asymmetry at F/N
and F1/F2 interfaces; and (4) spin-flipping at F/N, F1/F2 and N1/N2 interfaces.
Knowledge of spin-dependent scattering asymmetries in F-metals and F-alloys,
and of spin-flipping in N-metals and N-alloys was limited. We show how CPP-MR
measurements have quantified the scattering and spin-flipping parameters that
determine CPP-MR for a wide range of F- and N-metals and alloys and of F/N
pairs. We also review progress in finding techniques and F-alloys and F/N pairs
to enhance the CPP-MR to make it more competitive for devices.",['Jack Bass'],2015-11-23T19:54:27Z,http://arxiv.org/abs/1511.07387v1
End-to-End Parkinson Disease Diagnosis using Brain MR-Images by 3D-CNN,"In this work, we use a deep learning framework for simultaneous
classification and regression of Parkinson disease diagnosis based on MR-Images
and personal information (i.e. age, gender). We intend to facilitate and
increase the confidence in Parkinson disease diagnosis through our deep
learning framework.","['Soheil Esmaeilzadeh', 'Yao Yang', 'Ehsan Adeli']",2018-06-13T19:23:51Z,http://arxiv.org/abs/1806.05233v1
Autoencoders for Multi-Label Prostate MR Segmentation,"Organ image segmentation can be improved by implementing prior knowledge
about the anatomy. One way of doing this is by training an autoencoder to learn
a lowdimensional representation of the segmentation. In this paper, this is
applied in multi-label prostate MR segmentation, with some positive results.","['Ard de Gelder', 'Henkjan Huisman']",2018-06-09T13:10:46Z,http://arxiv.org/abs/1806.08216v2
"Generation of abdominal synthetic CTs from 0.35T MR images using
  generative adversarial networks for MR-only liver radiotherapy","Electron density maps must be accurately estimated to achieve valid dose
calculation in MR-only radiotherapy. The goal of this study is to assess
whether two deep learning models, the conditional generative adversarial
network (cGAN) and the cycle-consistent generative adversarial network
(cycleGAN), can generate accurate abdominal synthetic CT (sCT) images from
0.35T MR images for MR-only liver radiotherapy. A retrospective study was
performed using CT images and 0.35T MR images of 12 patients with liver (n=8)
and non-liver abdominal (n=4) cancer. CT images were deformably registered to
the corresponding MR images to generate deformed CT (dCT) images for treatment
planning. Both cGAN and cycleGAN were trained using MR and dCT transverse
slices. Four-fold cross-validation testing was conducted to generate sCT images
for all patients. The HU prediction accuracy was evaluated by voxel-wise
similarity metric between each dCT and sCT image for all 12 patients. dCT-based
and sCT-based dose distributions were compared using gamma and dose-volume
histogram (DVH) metric analysis for 8 liver patients. sCTcycleGAN achieved the
average mean absolute error (MAE) of 94.1 HU, while sCTcGAN achieved 89.8 HU.
In both models, the average gamma passing rates within all volumes of interest
were higher than 95% using a 2%, 2 mm criterion, and 99% using a 3%, 3 mm
criterion. The average differences in the mean dose and DVH metrics were within
+/-0.6% for the planning target volume and within +/-0.15% for evaluated organs
in both models. Results demonstrated that abdominal sCT images generated by
both cGAN and cycleGAN achieved accurate dose calculation for 8 liver
radiotherapy plans. sCTcGAN images had smaller average MAE and achieved better
dose calculation accuracy than sCTcyleGAN images. More abdominal patients will
be enrolled in the future to further evaluate two models.","['Jie Fu', 'Kamal Singhrao', 'Minsong Cao', 'Victoria Yu', 'Anand P. Santhanam', 'Yingli Yang', 'Minghao Guo', 'Ann C. Raldow', 'Dan Ruan', 'John H. Lewis']",2019-08-13T18:14:51Z,http://arxiv.org/abs/1908.04809v1
On minimal model theory for algebraic log surfaces,"We introduce the notion of generalized MR log canonical surfaces and
establish the minimal model theory for generalized MR log canonical surfaces in
full generality.",['Osamu Fujino'],2020-04-01T06:16:57Z,http://arxiv.org/abs/2004.00246v3
Deep Low-rank Prior in Dynamic MR Imaging,"The deep learning methods have achieved attractive performance in dynamic MR
cine imaging. However, all of these methods are only driven by the sparse prior
of MR images, while the important low-rank (LR) prior of dynamic MR cine images
is not explored, which limits the further improvements on dynamic MR
reconstruction. In this paper, a learned singular value thresholding
(Learned-SVT) operation is proposed to explore deep low-rank prior in dynamic
MR imaging for obtaining improved reconstruction results. In particular, we
come up with two novel and distinct schemes to introduce the learnable low-rank
prior into deep network architectures in an unrolling manner and a
plug-and-play manner respectively. In the unrolling manner, we put forward a
model-based unrolling sparse and low-rank network for dynamic MR imaging,
dubbed SLR-Net. The SLR-Net is defined over a deep network flow graph, which is
unrolled from the iterative procedures in the Iterative Shrinkage-Thresholding
Algorithm (ISTA) for optimizing a sparse and low-rank based dynamic MRI model.
In the plug-and-play manner, we present a plug-and-play LR network module that
can be easily embedded into any other dynamic MR neural networks without
changing the network paradigm. Experimental results show that both schemes can
further improve the state-of-the-art CS methods, such as k-t SLR, and
sparsity-driven deep learning-based methods, such as DC-CNN and CRNN, both
qualitatively and quantitatively.","['Ziwen Ke', 'Wenqi Huang', 'Jing Cheng', 'Zhuoxu Cui', 'Sen Jia', 'Haifeng Wang', 'Xin Liu', 'Hairong Zheng', 'Leslie Ying', 'Yanjie Zhu', 'Dong Liang']",2020-06-22T09:26:10Z,http://arxiv.org/abs/2006.12090v4
"Non-rigid 3D motion estimation at high temporal resolution from
  prospectively undersampled k-space data using low-rank MR-MOTUS","With the recent introduction of the MR-LINAC, an MR-scanner combined with a
radiotherapy LINAC, MR-based motion estimation has become of increasing
interest to (retrospectively) characterize tumor and organs-at-risk motion
during radiotherapy. To this extent, we introduce low-rank MR-MOTUS, a
framework to retrospectively reconstruct time-resolved non-rigid 3D+t
motion-fields from a single low-resolution reference image and prospectively
undersampled k-space data acquired during motion. Low-rank MR-MOTUS exploits
spatio-temporal correlations in internal body motion with a low-rank motion
model, and inverts a signal model that relates motion-fields directly to a
reference image and k-space data. The low-rank model reduces the
degrees-of-freedom, memory consumption and reconstruction times by assuming a
factorization of space-time motion-fields in spatial and temporal components.
Low-rank MR-MOTUS was employed to estimate motion in 2D/3D abdominothoracic
scans and 3D head scans. Data were acquired using golden-ratio radial readouts.
Reconstructed 2D and 3D respiratory motion-fields were respectively validated
against time-resolved and respiratory-resolved image reconstructions, and the
head motion against static image reconstructions from fully-sampled data
acquired right before and right after the motion. Results show that 2D+t
respiratory motion can be estimated retrospectively at 40.8
motion-fields-per-second, 3D+t respiratory motion at 7.6
motion-fields-per-second and 3D+t head-neck motion at 9.3
motion-fields-per-second. The validations show good consistency with image
reconstructions. The proposed framework can estimate time-resolved non-rigid 3D
motion-fields, which allows to characterize drifts and intra and inter-cycle
patterns in breathing motion during radiotherapy, and could form the basis for
real-time MR-guided radiotherapy.","['Niek R. F. Huttinga', 'Tom Bruijnen', 'Cornelis A. T. van den Berg', 'Alessandro Sbrizzi']",2020-07-01T13:44:52Z,http://arxiv.org/abs/2007.00488v1
"Bridging hybrid- and full-kinetic models with Landau-fluid electrons: I.
  2D magnetic reconnection","Magnetic reconnection (MR) plays a fundamental role in plasma dynamics under
many different conditions, from space and astrophysical environments to
laboratory devices. High-resolution in-situ measurements from space missions
allow to study naturally occurring MR processes in great detail. Alongside
direct measurements, numerical simulations play a key role in investigating the
fundamental physics underlying MR. The choice of an adequate plasma model to be
employed in numerical simulations, while also compromising with their
computational cost, is crucial to efficiently address the problem. We consider
a new plasma model that includes a refined electron response within the
hybrid-kinetic framework (kinetic ions, fluid electrons). The extent to which
this new model can reproduce a full-kinetic description of 2D MR, with
particular focus on its robustness during the non-linear stage, is evaluated.
We perform 2D simulations of MR with moderate guide field by means of three
different plasma models: a hybrid-Vlasov-Maxwell model with isotropic,
isothermal electrons, a hybrid-Vlasov-Landau-fluid (HVLF) model where an
anisotropic electron fluid is equipped with a Landau-fluid closure, and a
full-kinetic one. When compared to the full-kinetic case, the HVLF model
effectively reproduces the main features of MR, as well as several aspects of
the associated electron micro-physics and its feedback onto proton dynamics.
This includes the global evolution of MR and the local physics occurring within
the so-called electron-diffusion region, as well as the evolution of species
pressure anisotropy. In particular, anisotropy driven instabilities (such as
firehose, mirror, and cyclotron instabilities) play a relevant role in
regulating electrons anisotropy during the non-linear stage of MR. As expected,
the HVLF model captures all these features, except for the electron-cyclotron
instability.","['Francesco Finelli', 'Silvio S. Cerri', 'Francesco Califano', 'Francesco Pucci', 'Dimitri Laveder', 'Giovanni Lapenta', 'Thierry Passot']",2020-12-31T19:10:36Z,http://arxiv.org/abs/2101.00040v2
"Demystifying magnetic resonance measurements of the true diffusion
  propagator","In a recent work, a method for the magnetic resonance (MR) measurement of the
true diffusion propagator was introduced, which was subsequently implemented
and validated for free diffusion on a benchtop MR scanner. Here, we provide a
brief theoretical description of the method and discuss various experimental
regimes.","['Evren Özarslan', 'Magnus Herberthson']",2021-12-31T18:29:02Z,http://arxiv.org/abs/2112.15584v1
Algorithms for Least-Squares Noncartesian MR Image Reconstruction,"Iterative least-squares MR reconstructions typically use the Conjugate
Gradient algorithm, despite known numerical issues. This paper demonstrates
that the more recent LSMR algorithm has favourable numerical properties, and is
to be preferred in situations where Toeplitz embedding cannot be used to
accelerate the Conjugate Gradient method.",['Tobias C Wood'],2022-12-13T10:43:50Z,http://arxiv.org/abs/2212.06471v1
"CloudBrain-MRS: An Intelligent Cloud Computing Platform for in vivo
  Magnetic Resonance Spectroscopy Preprocessing, Quantification, and Analysis","Magnetic resonance spectroscopy (MRS) is an important clinical imaging method
for diagnosis of diseases. MRS spectrum is used to observe the signal intensity
of metabolites or further infer their concentrations. Although the magnetic
resonance vendors commonly provide basic functions of spectra plots and
metabolite quantification, the widespread clinical research of MRS is still
limited due to the lack of easy-to-use processing software or platform. To
address this issue, we have developed CloudBrain-MRS, a cloud-based online
platform that provides powerful hardware and advanced algorithms. The platform
can be accessed simply through a web browser, without the need of any program
installation on the user side. CloudBrain-MRS also integrates the classic
LCModel and advanced artificial intelligence algorithms and supports batch
preprocessing, quantification, and analysis of MRS data from different vendors.
Additionally, the platform offers useful functions: 1) Automatically
statistical analysis to find biomarkers for diseases; 2) Consistency
verification between the classic and artificial intelligence quantification
algorithms; 3) Colorful three-dimensional visualization for easy observation of
individual metabolite spectrum. Last, both healthy and mild cognitive
impairment patient data are used to demonstrate the functions of the platform.
To the best of our knowledge, this is the first cloud computing platform for in
vivo MRS with artificial intelligence processing. We have shared our cloud
platform at MRSHub, providing free access and service for two years. Please
visit https://mrshub.org/software_all/#CloudBrain-MRS or
https://csrc.xmu.edu.cn/CloudBrain.html.","['Xiaodie Chen', 'Jiayu Li', 'Dicheng Chen', 'Yirong Zhou', 'Zhangren Tu', 'Meijin Lin', 'Taishan Kang', 'Jianzhong Lin', 'Tao Gong', 'Liuhong Zhu', 'Jianjun Zhou', 'Lin Ou-yang', 'Jiefeng Guo', 'Jiyang Dong', 'Di Guo', 'Xiaobo Qu']",2023-06-19T15:32:58Z,http://arxiv.org/abs/2306.11021v2
"Note on a bomb dropped by Mr Conant and Mr Kruckman, and its
  consequences for the theory ACFG","This note is a reaction to Conant and Kruckman's recent preprint `Three
surprising instance of dividing'. It mainly consists of an erratum to the
author's paper `Forking, imaginaries and other features of ACFG', in light of
the results of the aforementioned paper.","[""Christian d'Elbée""]",2023-11-03T19:40:10Z,http://arxiv.org/abs/2311.02208v2
"Magnetoresistance in Heavily Underdoped YBa_2Cu_3O_{6+x}:
  Antiferromagnetic Correlations and Normal-State Transport","We report on a contrasting behavior of the in-plane and out-of-plane
magnetoresistance (MR) in heavily underdoped antiferromagnetic (AF)
YBa_2Cu_3O_{6+x} (x<0.37). The out-of-plane MR (I//c) is positive over most of
the temperature range and shows a sharp increase, by about two orders of
magnitude, upon cooling through the Neel temperature T_N. A contribution
associated with the AF correlations is found to dominate the out-of-plane MR
behavior for H//c from far above T_N, pointing to the key role of spin
fluctuations in the out-of-plane transport. In contrast, the transverse
in-plane MR (I//a(b);H//c) appears to be small and smooth through T_N, implying
that the development of the AF order has little effect on the in-plane
resistivity.","['A. N. Lavrov', 'Yoichi Ando', 'Kouji Segawa', 'J. Takeya']",1999-07-03T09:58:01Z,http://arxiv.org/abs/cond-mat/9907051v1
"Effect of γ-irradiation on superconducting transition temperature
  and resistive transition in polycrystalline YBa_{2}Cu_{3}O_(7-δ)","A bulk polycrystalline sample of YBa_(2)Cu_(3)O_(7-\delta) (\delta \approx
0.1) has been irradiated by \gamma-rays with ^{60}Co source. Non-monotonic
behavior of T_{c} with increasing irradiation dose \Phi (up to 220 MR) is
observed: T_{c} decreases at low doses (\Phi < 50 MR) from initial value
(\approx 93 K) by about 2 K and then rises, forming a minimum. At higher doses
(\Phi > 120 MR) T_{c} goes down again. The temperature width of resistive
transition increases rather sharply with dose below 75 MR and drops somewhat at
higher dose. The results observed are discussed, taking into account the
granular structure of sample studied and the influence of \gamma-rays on
intergrain Josephson coupling.","['B. I. Belevtsev', 'I. V. Volchok', 'N. V. Dalakova', 'V. I. Dotsenko', 'L. G. Ivanchenko', 'A. V. Kuznichenko', 'I. I. Logvinov']",2000-03-11T15:33:07Z,http://arxiv.org/abs/cond-mat/0003192v1
Tunability of High-Dielectric-Constant Materials from First Principles,"A first-principles method, based on density functional perturbation theory,
is presented for computing the leading order tunability of
high-dielectric-constant materials.",['K. M. Rabe'],2002-05-30T19:17:31Z,http://arxiv.org/abs/cond-mat/0205655v1
"Localization and electron-electron interaction effects in
  magnetoresistance of p-type Ge/Ge_{1-x}Si_x heterostructures","We report on the results of investigation the conductivity and
magnetoresistance (MR) temperature dependencies for the two strained multilayer
p-type Ge/Ge_{1-x}Si_x heterostructures. The usual logarithmic temperature
dependencies for zero magnetic field conductivity due to the weak localization
(WL) and electron- electron interaction (EEI) effects take place in both
samples. For one of the samples the negative MR is observed in a whole range of
magnetic fields up to ~1T at T <=12K, but for the other sample the MR
transforms from the negative to positive at B >= 0.2T and T >=1.3K. We
attribute such a behavior to the interplay of two types of holes due to partial
filling of the second subband. Extrapolation of the observed high-field
parabolic MR to B = 0 allows to separate WL and EEI contributions to the total
quantum corrections to conductivity at B = 0 resulting for both of our
structures in that EEI part is ~2/3 and the WL part is ~1/3.","['Yu. G. Arapov', 'G. I. Harus', 'V. N. Neverov', 'A. T. Lonchakov', 'N. G. Shelushinina', 'M. V. Yakunin']",2002-12-27T07:04:43Z,http://arxiv.org/abs/cond-mat/0212612v1
"'Giant' normal state magnetoresistances of
  Bi$_{2}$Sr$_{2}$CaCu$_{2}$O$_{8+δ}$","Magnetoresistance (MR) of Bi-2212 single crystals with T$_{c}$ $\approx 87-92
K$ is studied in pulsed magnetic fields up to 50T along the c-axis in a wide
temperature range. The negative out-of-plane and the positive in-plane MRs are
measured in the normal state. Both MRs have similar magnitudes, exceeding any
orbital contribution by two orders in magnitude. These are explained as a
result of the magnetic pair-breaking of preformed pairs. Resistive upper
critical fields H$_{c2}$(T) determined from the in-- and out-of-plane MRs are
about the same. They show non-BCS temperature dependences compatible with the
Bose-Einstein condensation field of preformed charged bosons.","['V. N. Zavaritsky', 'J. Vanacken', 'V. V. Moshchalkov', 'A. S. Alexandrov']",2003-08-13T17:42:31Z,http://arxiv.org/abs/cond-mat/0308256v1
Paramagnetic anisotropic magnetoresistance in thin films of SrRuO3,"SrRuO3 is an itinerant ferromagnet and in its thin film form when grown on
miscut SrTiO3 it has Tc of ~ 150 K and strong uniaxial anisotropy. We measured
both the Hall effect and the magnetoresistance (MR) of the films as a function
of the angle between the applied field and the normal to the films at
temperatures above Tc. We extracted the extraordinary Hall effect that is
proportional to the perpendicular component of the magnetization and thus the
MR for each angle of the applied field could be correlated with the magnitude
and orientation of the induced magnetization. We successfully fit the MR data
with a second order magnetization expansion, which indicates large anisotropic
MR in the paramagnetic state. The extremum values of resistivity are not
obtained for currents parallel or perpendicular to the magnetization, probably
due to the crystal symmetry.","['Isaschar Genish', 'Yevgeny Kats', 'Lior Klein', 'James W. Reiner', 'M. R. Beasley']",2003-11-14T11:18:04Z,http://arxiv.org/abs/cond-mat/0311343v1
"Origin of the anomalous low temperature upturn in resistivity in the
  electron-doped cuprates","The temperature, doping and field dependences of the magnetoresistance (MR)
in Pr_(2-x)Ce_(x)CuO_(4-delta) films are reported. We distinguish between
orbital MR, found when the magnetic field is applied perpendicular to the ab
planes, and the nearly isotropic spin MR. The latter, the major MR effect in
the superconducting samples, appears in the region of the doping-temperature
phase diagram where d(rho)/dT<0, or an upturn in the resistivity appears. We
conclude that the upturn originates from spin scattering processes.","['Y. Dagan', 'A. Biswas', 'M. C. Barr', 'W. M. Fisher', 'R. L. Greene']",2004-08-23T17:02:53Z,http://arxiv.org/abs/cond-mat/0408490v2
"Magnetotransport properties of ferromagnetic
  Pr0.85Ca0.15MnO3/ferroelectric Ba0.6Sr0.4TiO3 superlattice films","Artificial superlattices designed with ferromagnetic Pr0.85Ca0.15MnO3
insulating layer and ferroelectric Ba0.6Sr0.4TiO3 layer were grown on (100)
SrTiO3 substrates. The magnetotransport properties were measured with the
current perpendicular to the plane geometry. An increase in magnetoresistance
(MR), with no significant low field effect, was observed as the number of
ferroelectric Ba0.6Sr0.4TiO3 layer thickness increases even up to 9 unit cells.
For example, the superlattice [(Pr0.85Ca0.15MnO3)10(Ba0.6Sr0.4TiO3)9]25 shows
35 % MR at 100 K, though the Pr0.85Ca0.15MnO3 film was a robust insulator with
negligible MR even at high applied magnetic field. This observed large MR
cannot be explained by simple interfacial ferromagnetism or by the tunneling
magnetoresistance. One possible explanation could be the effect due to the
ferroelectric spacer layer and the associated magnetoelectric coupling.","['P. Murugavel', 'P. Padhan', 'W. Prellier']",2004-10-04T16:44:45Z,http://arxiv.org/abs/cond-mat/0410081v1
"Large magnetoresistance in low temperature metallic region of manganite
  compounds (La0.7-2xEux)(Ca0.3Srx)MnO3 (0.05<x<0.15)","Magnetoresistance (MR) and magnetization (d.c and a.c) measurements have been
carried out on the manganites, (La0.7-2xEux)(Ca0.3Srx)MnO3 (0.05<x<0.15), in
the temperature range of 5K-320K. At 5K, an unusually large MR of almost 98% is
observed in the x=0.15 sample, nearly up to fields of 4-5 Tesla. This large
high-field MR occurs in the metallic region, far below the insulator-metal
transition temperature, and does not vary linearly with applied field. The
unusual magnetoresistance is explained the light of various possibilities of
phase segregation and cluster spin-glass behavior. Keywords: Manganites, High
field MR, Phase segregation.","['D. S. Rana', 'C. M. Thaker', 'K. R. Mavani', 'D. G. Kuberkar', 'S. K. Malik']",2004-12-16T07:14:08Z,http://arxiv.org/abs/cond-mat/0412422v1
"Large magnetoresistance at room-temperature in small molecular weight
  organic semiconductor sandwich devices","We present an extensive study of a large, room temperature negative
magnetoresistance (MR) effect in tris-(8-hydroxyquinoline) aluminum sandwich
devices in weak magnetic fields. The effect is similar to that previously
discovered in polymer devices. We characterize this effect and discuss its
dependence on field direction, voltage, temperature, film thickness, and
electrode materials. The MR effect reaches almost 10% at fields of
approximately 10 mT at room temperature. The effect shows only a weak
temperature dependence and is independent of the sign and direction of the
magnetic field. Measuring the devices' current-voltage characteristics, we find
that the current depends on the voltage through a power-law. We find that the
magnetic field changes the prefactor of the power-law, whereas the exponent
remains unaffected. We also studied the effect of the magnetic field on the
electroluminescence (MEL) of the devices and analyze the relationship between
MR and MEL. We find that the largest part of MEL is simply a consequence of a
change in device current caused by the MR effect.","['Ö. Mermer', 'G. Veeraraghavan', 'T. L. Francis', 'M. Wohlgenannt']",2005-01-07T00:13:43Z,http://arxiv.org/abs/cond-mat/0501124v1
