title,summary,authors,published,link
"Lysine-Cysteine-Serine-Tryptophan Inserted into the DNA-Binding Domain
  of Human Mineralocorticoid Receptor Increases Transcriptional Activation by
  Aldosterone","Due to alternative splicing in an ancestral DNA-binding domain (DBD) of the
mineralocorticoid receptor (MR), humans contain two almost identical MR
transcripts with either 984 amino acids (MR-984) or 988 amino acids (MR-988),
in which their DBDs differ by only four amino acids, Lys,Cys,Ser,Trp (KCSW).
Human MRs also contain mutations at two sites, codons 180 and 241, in the amino
terminal domain (NTD). Together, there are five distinct full-length human MR
genes in GenBank. Human MR-984, which was cloned in 1987, has been extensively
studied. Human MR-988, cloned in 1995, contains KCSW in its DBD. Neither this
human MR-988 nor the other human MR-988 genes have been studied for their
response to aldosterone and other corticosteroids. Here, we report that
transcriptional activation of human MR-988 by aldosterone is increased by about
50% compared to activation of human MR-984 in HEK293 cells transfected with the
TAT3 promoter, while the half-maximal response (EC50) is similar for
aldosterone activation of MR-984 and MR-988. Transcriptional activation of
human MR also depends on the amino acids at codons 180 and 241. Interestingly,
in HEK293 cells transfected with the MMTV promoter, transcriptional activation
by aldosterone of human MR-988 is similar to activation of human MR-984,
indicating that the promoter has a role in the regulation of the response of
human MR-988 to aldosterone. The physiological responses to aldosterone and
other corticosteroids in humans with MR genes containing KCSW and with
differences at codons 180 and 241 in the NTD warrant investigation.","['Yoshinao Katsu', 'Jiawen Zhang', 'Michael E. Baker']",2024-05-16T20:30:18Z,http://arxiv.org/abs/2405.10432v1
"MR-Scout: Automated Synthesis of Metamorphic Relations from Existing
  Test Cases","Metamorphic Testing (MT) alleviates the oracle problem by defining oracles
based on metamorphic relations (MRs), that govern multiple related inputs and
their outputs. However, designing MRs is challenging, as it requires
domain-specific knowledge. This hinders the widespread adoption of MT. We
observe that developer-written test cases can embed domain knowledge that
encodes MRs. Such encoded MRs could be synthesized for testing not only their
original programs but also other programs that share similar functionalities.
  In this paper, we propose MR-Scout to automatically synthesize MRs from test
cases in open-source software (OSS) projects. MR-Scout first discovers
MR-encoded test cases (MTCs), and then synthesizes the encoded MRs into
parameterized methods (called codified MRs), and filters out MRs that
demonstrate poor quality for new test case generation. MR-Scout discovered over
11,000 MTCs from 701 OSS projects. Experimental results show that over 97% of
codified MRs are of high quality for automated test case generation,
demonstrating the practical applicability of MR-Scout. Furthermore,
codified-MRs-based tests effectively enhance the test adequacy of programs with
developer-written tests, leading to 13.52% and 9.42% increases in line coverage
and mutation score, respectively. Our qualitative study shows that 55.76% to
76.92% of codified MRs are easily comprehensible for developers.","['Congying Xu', 'Valerio Terragni', 'Hengcheng Zhu', 'Jiarong Wu', 'Shing-Chi Cheung']",2023-04-15T12:53:32Z,http://arxiv.org/abs/2304.07548v3
"Novel Evolution of the Mineralocorticoid Receptor in Humans compared to
  Chimpanzees, Gorillas and Orangutans","Five distinct full-length mineralocorticoid receptor (MR) genes have been
identified in humans. These human MRs can be distinguished by the presence or
absence of an in-frame insertion of 12 base pairs coding for Lys, Cys, Ser, Trp
(KCSW) in their DNA-binding domain (DBD) and the presence of two amino acid
mutations in their amino terminal domain (NTD). Two human MRs with the KCSW
insertion (MR-KCSW) and three human MRs without KCSW in the DBD have been
identified. The three human MRs without KCSW contain either (Ile-180, Ala-241)
or (Val-180, Val-241) or (Ile-180, Val-241) in their NTD. The two human MRs
with KCSW contain either (Val-180, Val-241) or (Ile-180, Val-241) in their NTD.
Human MR-KCSW with (Ile-180, Ala-241) has not been cloned. In contrast,
chimpanzees contain two MRs with KCSW and two MRs without KCSW in their DBD and
both contain only Ile180, Val-241 in their NTDs. Each pair of chimpanzee MRs
differ at another amino acid in the NTD. A chimpanzee MR with either Val-180,
Val-241 or Ile-180, Ala-241 in the NTD has not been cloned. Gorillas and
orangutans each contain one MR with KCSW in the DBD and one MR without KCSW.
Both gorilla and orangutan MRs contain I-180, Val-241 in their NTD. Neither
Val-180, Val-241 nor Ile-180, Ala-241 are found in the NTD in either a gorilla
MR or an orangutan MR. These data suggest that human MRs with Val-180, Val-241
or Ile-180, Ala-241 in the NTD evolved after humans and chimpanzees diverged
from their common ancestor. These unique human MRs may have had a role in the
divergent evolution of humans from chimpanzees. Studies are underway to
characterize transcriptional activation of the five human MRs by aldosterone,
cortisol, and other corticosteroids for comparison with each other to elucidate
the roles of these MRs in human physiology.","['Yoshinao Katsu', 'Jiawen Zhang', 'Michael E. Baker']",2023-12-08T22:33:24Z,http://arxiv.org/abs/2312.05396v1
Towards a Complete Metamorphic Testing Pipeline,"Metamorphic Testing (MT) addresses the test oracle problem by examining the
relationships between input-output pairs in consecutive executions of the
System Under Test (SUT). These relations, known as Metamorphic Relations (MRs),
specify the expected output changes resulting from specific input changes.
However, achieving full automation in generating, selecting, and understanding
MR violations poses challenges. Our research aims to develop methods and tools
that assist testers in generating MRs, defining constraints, and providing
explainability for MR outcomes. In the MR generation phase, we explore
automated techniques that utilise a domain-specific language to generate and
describe MRs. The MR constraint definition focuses on capturing the nuances of
MR applicability by defining constraints. These constraints help identify the
specific conditions under which MRs are expected to hold. The evaluation and
validation involve conducting empirical studies to assess the effectiveness of
the developed methods and validate their applicability in real-world regression
testing scenarios. Through this research, we aim to advance the automation of
MR generation, enhance the understanding of MR violations, and facilitate their
effective application in regression testing.","['Alejandra Duque-Torres', 'Dietmar Pfahl']",2023-09-30T10:49:22Z,http://arxiv.org/abs/2310.00338v1
"Magnetoresistance of 2D and 3D Electron Gas in LaAlO3/SrTiO3
  Heterostructures: Influence of Magnetic Ordering, Interface Scattering and
  Dimensionality","Magnetoresistance (MR) anisotropy in LaAlO3/SrTiO3 (LAO/STO) interfaces is
compared between samples prepared in high oxygen partial pressure (PO2) of 10-4
mbar exhibiting quasi-two-dimensional (quasi-2D) electron gas and low PO2 of
10-6 mbar exhibiting 3D conductivity. While MR of an order of magnitude larger
was observed in low PO2 samples compared to those of high PO2 samples, large MR
anisotropies were observed in both cases. The MR with the out-of-plane field is
always larger compared to the MR with in-plane field suggesting lower
dissipation of electrons from interface versus defect scattering. The quasi-2D
interfaces show a negative MR at low temperatures while the 3D interfaces show
positive MR for all temperatures. Furthermore, the angle relationship of MR
anisotropy for these two different cases and temperature dependence of in-plane
MR are also presented. Our study demonstrates that MR can be used to
distinguish the dimensionality of the charge transport and various (defect,
magnetic center, and interface boundary) scattering processes in this system.","['X. Wang', 'W. M Lü', 'A. Annadi', 'Z. Q. Liu', 'S. Dhar', 'T. Venkatesan', 'Ariando']",2011-10-24T17:49:01Z,http://arxiv.org/abs/1110.5290v1
"Transcriptional Activation of Elephant Shark Mineralocorticoid Receptor
  by Corticosteroids, Progesterone and Spironolactone","We report the analysis of activation by corticosteroids and progesterone of
full-length mineralocorticoid receptor (MR) from elephant shark, a
cartilaginous fish belonging to the oldest group of jawed vertebrates. Based on
their measured activities, aldosterone, cortisol, 11-deoxycorticosterone,
corticosterone, 11-deoxcortisol, progesterone and 19-norprogesterone are
potential physiological mineralocorticoids. However, aldosterone, the
physiological mineralocorticoid in humans and other terrestrial vertebrates, is
not found in cartilaginous or ray-finned fishes. Because progesterone is a
precursor for corticosteroids that activate elephant shark MR, we propose that
progesterone was an ancestral ligand for elephant shark MR. Although
progesterone activates ray-finned fish MRs, progesterone does not activate
human, amphibian or alligator MRs, suggesting that during the transition to
terrestrial vertebrates, progesterone lost the ability to activate the MR.
Comparison of RNA-sequence analysis of elephant shark MR with that of human MR
suggests that MR expression in the human brain, heart, ovary, testis and other
non-epithelial tissues evolved in cartilaginous fishes. Together, these data
suggest that progesterone-activated MR may have unappreciated functions in
elephant shark ovary and testis.","['Yoshinao Katsu', 'Satomi Kohno', 'Kaori Oka', 'Xiaozhi Lin', 'Sumika Otake', 'Nisha E. Pillai', 'Wataru Takagi', 'Susumu Hyodo', 'Byrappa Venkatesh', 'Michael E. Baker']",2018-08-22T19:43:02Z,http://arxiv.org/abs/1808.07539v1
Practical Repetition-Aware Grammar Compression,"The goal of grammar compression is to construct a small sized context free
grammar which uniquely generates the input text data. Among grammar compression
methods, RePair is known for its good practical compression performance.
MR-RePair was recently proposed as an improvement to RePair for constructing
small-sized context free grammar for repetitive text data. However, a compact
encoding scheme has not been discussed for MR-RePair. We propose a practical
encoding method for MR-RePair and show its effectiveness through comparative
experiments. Moreover, we extend MR-RePair to run-length context free grammar
and design a novel variant for it called RL-MR-RePair. We experimentally
demonstrate that a compression scheme consisting of RL-MR-RePair and the
proposed encoding method show good performance on real repetitive datasets.",['Isamu Furuya'],2019-10-29T18:58:48Z,http://arxiv.org/abs/1910.13479v1
"Motion correction for PET using subspace-based real-time MR imaging in
  simultaneous PET/MR","Image quality of PET reconstructions is degraded by subject motion occurring
during the acquisition. MR-based motion correction approaches have been studied
for PET/MR scanners and have been successful at capturing regular motion
patterns, when used in conjunction with surrogate signals (e.g. navigators) to
detect motion. However, handling irregular respiratory motion and bulk motion
remains challenging. In this work, we propose an MR-based motion correction
method relying on subspace-based real-time MR imaging to estimate motion fields
used to correct PET reconstructions. We take advantage of the low-rank
characteristics of dynamic MR images to reconstruct high-resolution MR images
at high frame rates from highly undersampled k-space data. Reconstructed
dynamic MR images are used to determine motion phases for PET reconstruction
and estimate phase-to-phase nonrigid motion fields able to capture complex
motion patterns such as irregular respiratory and bulk motion. MR-derived
binning and motion fields are used for PET reconstruction to generate
motion-corrected PET images. The proposed method was evaluated on in vivo data
with irregular motion patterns. MR reconstructions accurately captured motion,
outperforming state-of-the-art dynamic MR reconstruction techniques. Evaluation
of PET reconstructions demonstrated the benefits of the proposed method over
standard methods in terms of motion artifact reduction. The proposed method can
improve the image quality of motion-corrected PET reconstructions in clinical
applications.","['Thibault Marin', 'Yanis Djebra', 'Paul K. Han', 'Yanis Chemli', 'Isabelle Bloch', 'Georges El Fakhri', 'Jinsong Ouyang', 'Yoann Petibon', 'Chao Ma']",2020-08-27T20:04:08Z,http://arxiv.org/abs/2008.12359v2
"Magneto-transport Effects in Topological Insulator Bi$_2$Se$_3$
  Nanoribbons","Magneto-resistance (MR) of Bi$_2$Se$_3$ nanoribbons is studied over a broad
range of temperature ($T$=300K-2K) and under various magnetic field ($B$)
orientations. The MR is strongly anisotropic with the perpendicular MR much
larger than the longitudinal and transverse MRs. The perpendicular MR exhibits
quadratic $B$-dependence in low fields and becomes linear at high $B$. However,
when $T$ increases, the perpendicular MR becomes linear over the whole magnetic
field range (0-9T) up to room temperature. This unusual linear MR is discussed
in the context of the linear quantum MR of the topological surface-states. We
also observe the boundary-scattering effect in MR at low temperatures, which
indicates that the out-of-plane Fermi momentum is much smaller the in-plane
Fermi momentum, excluding the simple three-dimensional Fermi surface picture.","['Hao Tang', 'Dong Liang', 'Richard L. J. Qiu', 'Xuan P. A. Gao']",2010-03-31T17:15:00Z,http://arxiv.org/abs/1003.6099v4
Deep MR to CT Synthesis using Unpaired Data,"MR-only radiotherapy treatment planning requires accurate MR-to-CT synthesis.
Current deep learning methods for MR-to-CT synthesis depend on pairwise aligned
MR and CT training images of the same patient. However, misalignment between
paired images could lead to errors in synthesized CT images. To overcome this,
we propose to train a generative adversarial network (GAN) with unpaired MR and
CT images. A GAN consisting of two synthesis convolutional neural networks
(CNNs) and two discriminator CNNs was trained with cycle consistency to
transform 2D brain MR image slices into 2D brain CT image slices and vice
versa. Brain MR and CT images of 24 patients were analyzed. A quantitative
evaluation showed that the model was able to synthesize CT images that closely
approximate reference CT images, and was able to outperform a GAN model trained
with paired MR and CT images.","['Jelmer M. Wolterink', 'Anna M. Dinkla', 'Mark H. F. Savenije', 'Peter R. Seevinck', 'Cornelis A. T. van den Berg', 'Ivana Isgum']",2017-08-03T14:18:43Z,http://arxiv.org/abs/1708.01155v1
Metamorphic Relation Prioritization for Effective Regression Testing,"Metamorphic testing (MT) is widely used for testing programs that face the
oracle problem. It uses a set of metamorphic relations (MRs), which are
relations among multiple inputs and their corresponding outputs to determine
whether the program under test is faulty. Typically, MRs vary in their ability
to detect faults in the program under test, and some MRs tend to detect the
same set of faults. In this paper, we propose approaches to prioritize MRs to
improve the efficiency and effectiveness of MT for regression testing. We
present two MR prioritization approaches: (1) fault-based and (2)
coverage-based. To evaluate these MR prioritization approaches, we conduct
experiments on three complex open-source software systems. Our results show
that the MR prioritization approaches developed by us significantly outperform
the current practice of executing the source and follow-up test cases of the
MRs in an ad-hoc manner in terms of fault detection effectiveness. Further,
fault-based MR prioritization leads to reducing the number of source and
follow-up test cases that needs to be executed as well as reducing the average
time taken to detect a fault, which would result in saving time and cost during
the testing process.","['Madhusudan Srinivasan', 'Upulee Kanewala']",2021-09-20T19:06:17Z,http://arxiv.org/abs/2109.09798v1
"3D cine-magnetic resonance imaging using spatial and temporal implicit
  neural representation learning (STINR-MR)","The reconstruction of 3D cine-MRI is challenged by highly undersampled
k-space data in each cine frame, due to the slow speed of MR signal
acquisition. We proposed a machine learning-based framework, spatial and
temporal implicit neural representation learning (STINR-MR), for accurate 3D
cine-MRI reconstruction from highly undersampled data. STINR-MR used a joint
reconstruction and deformable registration approach to address the ill-posed
spatiotemporal reconstruction problem, by solving a reference-frame 3D MR image
and a corresponding motion model which deforms the reference frame to each cine
frame. The reference-frame image was reconstructed as a spatial implicit neural
representation (INR) network, which learns the mapping from input 3D spatial
coordinates to corresponding MR values. The dynamic motion model was
constructed via a temporal INR, as well as basis deformation vector
fields(DVFs) extracted from prior/onboard 4D-MRIs. The learned INR encodes
input time points and outputs corresponding weighting factors to combine the
basis DVFs into time-resolved motion fields. STINR-MR was evaluated using MR
data simulated from the 4D extended cardiac-torso (XCAT) digital phantom and MR
data acquired clinically from a healthy human subject. Its reconstruction
accuracy was also compared with that of the model-based non-rigid motion
estimation method (MR-MOTUS). STINR-MR can reconstruct 3D cine-MR images with
high temporal (<100 ms) and spatial (3 mm) resolutions to accurately capture
different irregular motion patterns. Compared with MR-MOTUS, STINR-MR
consistently reconstructed images with better quality, fewer artifacts, and
achieved superior tumor localization accuracy. STINR-MR provides a lightweight
and efficient framework for accurate 3D cine-MRI reconstruction, and does not
require external data for pre-training to avoid generalizability issues
encountered in deep learning methods.","['Hua-Chieh Shao', 'Tielige Mengke', 'Jie Deng', 'You Zhang']",2023-08-18T18:48:06Z,http://arxiv.org/abs/2308.09771v1
"Short echo time relaxation-enhanced MR spectroscopy reveals broad
  downfield resonances","Purpose: Most MR spectroscopy (MRS) pulse sequences rely on broadband
excitation with water saturation and typically focus on upfield signals. By
contrast, the downfield spectrum, which contains many potentially useful
resonances, is typically not targeted because conventional water-suppressed
techniques indirectly saturate the labile protons through exchange.
Relaxation-enhanced MRS (RE-MRS) uses frequency-selective excitation while
actively avoiding bulk water perturbation, thereby enabling high-quality
downfield spectroscopy. However, RE-MRS typically requires very long (typically
>40 ms) echo times (TEs) due to its localization module, which inevitably
decreases sensitivity and filters shorter T2 components. Here, we overcome this
limitation by combining RE-MRS and image selected in vivo spectroscopy (ISIS)
localization, abbreviated iRE-MRS, which in turn allows very short TEs (5 ms
using our hardware).
  Methods: Experiments were performed in vitro for validation as well as and in
in vivo rat brains at 9.4T.
  Results: The new iRE-MRS methodology was validated in phantoms where good
performance was noted. When the downfield spectrum was investigated at short
TEs in in vivo rat brains, iRE-MRS provided very high sensitivity; the ensuing
downfield spectra encompassed numerous broad peaks, as well as a broad
baseline. All downfield spectral peaks were highly attenuated by increasing TEs
as well as by applying water saturation, although to different extent. The
signal ratios also varied between TEs, suggesting that exchange rates are
different among the downfield signals.
  Conclusions: Short-TE iRE 1H downfield MRS opens new directions in the
investigation of in vivo downfield metabolites and their role on healthy and
disease processes.","['Sónia I. Gonçalves', 'Clémence Ligneul', 'Noam Shemesh']",2019-05-22T14:15:18Z,http://arxiv.org/abs/1905.09158v1
"Enhanced Magnetic Resonance Image Synthesis with Contrast-Aware
  Generative Adversarial Networks","A Magnetic Resonance Imaging (MRI) exam typically consists of the acquisition
of multiple MR pulse sequences, which are required for a reliable diagnosis.
Each sequence can be parameterized through multiple acquisition parameters
affecting MR image contrast, signal-to-noise ratio, resolution, or scan time.
With the rise of generative deep learning models, approaches for the synthesis
of MR images are developed to either synthesize additional MR contrasts,
generate synthetic data, or augment existing data for AI training. However,
current generative approaches for the synthesis of MR images are only trained
on images with a specific set of acquisition parameter values, limiting the
clinical value of these methods as various sets of acquisition parameter
settings are used in clinical practice. Therefore, we trained a generative
adversarial network (GAN) to generate synthetic MR knee images conditioned on
various acquisition parameters (repetition time, echo time, image orientation).
This approach enables us to synthesize MR images with adjustable image
contrast. In a visual Turing test, two experts mislabeled 40.5% of real and
synthetic MR images, demonstrating that the image quality of the generated
synthetic and real MR images is comparable. This work can support radiologists
and technologists during the parameterization of MR sequences by previewing the
yielded MR contrast, can serve as a valuable tool for radiology training, and
can be used for customized data generation to support AI training.","['Jonas Denck', 'Jens Guehring', 'Andreas Maier', 'Eva Rothgang']",2021-02-17T11:39:36Z,http://arxiv.org/abs/2102.09386v2
"Two Wrongs Can Make a Right: A Transfer Learning Approach for Chemical
  Discovery with Chemical Accuracy","Appropriately identifying and treating molecules and materials with
significant multi-reference (MR) character is crucial for achieving high data
fidelity in virtual high throughput screening (VHTS). Nevertheless, most VHTS
is carried out with approximate density functional theory (DFT) using a single
functional. Despite development of numerous MR diagnostics, the extent to which
a single value of such a diagnostic indicates MR effect on chemical property
prediction is not well established. We evaluate MR diagnostics of over 10,000
transition metal complexes (TMCs) and compare to those in organic molecules. We
reveal that only some MR diagnostics are transferable across these materials
spaces. By studying the influence of MR character on chemical properties (i.e.,
MR effect) that involves multiple potential energy surfaces (i.e., adiabatic
spin splitting, $\Delta E_\mathrm{H-L}$, and ionization potential, IP), we
observe that cancellation in MR effect outweighs accumulation. Differences in
MR character are more important than the total degree of MR character in
predicting MR effect in property prediction. Motivated by this observation, we
build transfer learning models to directly predict CCSD(T)-level adiabatic
$\Delta E_\mathrm{H-L}$ and IP from lower levels of theory. By combining these
models with uncertainty quantification and multi-level modeling, we introduce a
multi-pronged strategy that accelerates data acquisition by at least a factor
of three while achieving chemical accuracy (i.e., 1 kcal/mol) for robust VHTS.","['Chenru Duan', 'Daniel B. K. Chu', 'Aditya Nandy', 'Heather J. Kulik']",2022-01-11T23:45:52Z,http://arxiv.org/abs/2201.04243v1
