title,summary,authors,published,link
Outdoor Position Recovery from HeterogeneousTelco Cellular Data,"Recent years have witnessed unprecedented amounts of data generated by
telecommunication (Telco) cellular networks. For example, measurement records
(MRs) are generated to report the connection states between mobile devices and
Telco networks, e.g., received signal strength. MR data have been widely used
to localize outdoor mobile devices for human mobility analysis, urban planning,
and traffic forecasting. Existing works using first-order sequence models such
as the Hidden Markov Model (HMM) attempt to capture spatio-temporal locality in
underlying mobility patterns for lower localization errors. The HMM approaches
typically assume stable mobility patterns of the underlying mobile devices. Yet
real MR datasets exhibit heterogeneous mobility patterns due to mixed
transportation modes of the underlying mobile devices and uneven distribution
of the positions associated with MR samples. Thus, the existing solutions
cannot handle these heterogeneous mobility patterns. we propose a multi-task
learning-based deep neural network (DNN) framework, namely PRNet+, to
incorporate outdoor position recovery and transportation mode detection. To
make sure the framework work, PRNet+ develops a feature extraction module to
precisely learn local-, short- and long-term spatio-temporal locality from
heterogeneous MR samples. Extensive evaluation on eight datasets collected at
three representative areas in Shanghai indicates that PRNet+ greatly
outperforms state-of-the-arts.","['Yige Zhang', 'Weixiong Rao', 'Kun Zhang', 'Lei Chen']",2021-08-24T10:02:32Z,http://arxiv.org/abs/2108.10613v1
Eye-Tracking-Based Design of Mixed Reality Learning Environments in STEM,"With the advent of commercially available Mixed-Reality(MR)-headsets in
recent years MR-assisted learning started to play a vital role in educational
research, especially related to STEM (science, technology, engineering and
mathematics) education. Along with these developments it seems viable to
further frameworks and structured design processes for MR-based learning
environments. Instead of a widely applicable framework for designing
educational MR applications, we here consider the case of virtually enhancing
physical hands-on experiments in STEM, where students are given a certain
problem to solve, and how to design these. For this focused realm, we suggest
an empirically driven problemand user-centred design process for MR
applications to get novices to act more like experts and exemplify it for a
specific experiment and problem set containing a non-trivial electric circuit
with capacitors and coils.","['Dörte Sonntag', 'Oliver Bodensiek']",2021-09-07T08:48:01Z,http://arxiv.org/abs/2109.02940v1
"ImUnity: a generalizable VAE-GAN solution for multicenter MR image
  harmonization","ImUnity is an original deep-learning model designed for efficient and
flexible MR image harmonization. A VAE-GAN network, coupled with a confusion
module and an optional biological preservation module, uses multiple 2D-slices
taken from different anatomical locations in each subject of the training
database, as well as image contrast transformations for its self-supervised
training. It eventually generates 'corrected' MR images that can be used for
various multi-center population studies. Using 3 open source databases (ABIDE,
OASIS and SRPBS), which contain MR images from multiple acquisition scanner
types or vendors and a large range of subjects ages, we show that ImUnity: (1)
outperforms state-of-the-art methods in terms of quality of images generated
using traveling subjects; (2) removes sites or scanner biases while improving
patients classification; (3) harmonizes data coming from new sites or scanners
without the need for an additional fine-tuning and (4) allows the selection of
multiple MR reconstructed images according to the desired applications. Tested
here on T1-weighted images, ImUnity could be used to harmonize other types of
medical images.","['Stenzel Cackowski', 'Emmanuel L. Barbier', 'Michel Dojat', 'Thomas Christen']",2021-09-14T15:21:19Z,http://arxiv.org/abs/2109.06756v1
Velocity-aware Antenna Selection in Predictor Antenna Systems,"Moving relay (MR), which is a candidate solution for supporting in-vehicle
users, has been investigated in different studies. Due to the mobile nature of
the MR, acquiring channel state information at the transmitter side (CSIT) is
challenging because of the fast-changing environment around the vehicle. On top
of an MR, one can use predictor antenna (PA), i.e., an additional antenna in
front of the receive antenna (RA), to obtain CSIT, and recent works have
investigated the benefits of such a set up. PA-aided CSIT acquisition normally
works with the help of different content information such as the location and
the velocity of the MR. In this paper, we study the effect of velocity
awareness on the PA system, and develop adaptive antenna selection schemes in
PA-assisted MRs. Results show that, compared to no-CSIT schemes, a
velocity-aware antenna selection-based PA system can improve the end-to-end
throughput by an order of magnitude.","['Hao Guo', 'Behrooz Makki', 'Tommy Svensson']",2021-09-30T19:49:32Z,http://arxiv.org/abs/2110.00064v1
"Deep multi-modal aggregation network for MR image reconstruction with
  auxiliary modality","Magnetic resonance (MR) imaging produces detailed images of organs and
tissues with better contrast, but it suffers from a long acquisition time,
which makes the image quality vulnerable to say motion artifacts. Recently,
many approaches have been developed to reconstruct full-sampled images from
partially observed measurements to accelerate MR imaging. However, most
approaches focused on reconstruction over a single modality, neglecting the
discovery of correlation knowledge between the different modalities. Here we
propose a Multi-modal Aggregation network for mR Image recOnstruction with
auxiliary modality (MARIO), which is capable of discovering complementary
representations from a fully sampled auxiliary modality, with which to
hierarchically guide the reconstruction of a given target modality. This
implies that our method can selectively aggregate multi-modal representations
for better reconstruction, yielding comprehensive, multi-scale, multi-modal
feature fusion. Extensive experiments on IXI and fastMRI datasets demonstrate
the superiority of the proposed approach over state-of-the-art MR image
reconstruction methods in removing artifacts.","['Chun-Mei Feng', 'Huazhu Fu', 'Tianfei Zhou', 'Yong Xu', 'Ling Shao', 'David Zhang']",2021-10-15T13:16:59Z,http://arxiv.org/abs/2110.08080v3
"Current-in-plane magnetoresistance in chiral-molecule/ferromagnetic
  metal bilayer due to thermally induced spin polarization","We report chirality-induced current-in-plane magnetoresistance (CIP-MR) in
chiral molecule/ferromagnetic metal bilayer at room temperature. The previously
reported chiralityinduced current-perpendicular-to-plane magnetoresistance
(CPP-MR) originates from the chiral induced spin-selectivity (CISS) effect that
needs charge-current passing through the molecule. In contrast, the observed
CIP-MR in the present study requires no bias charge current through the
molecule. The temperature dependence of CIP-MR suggests thermally induced
spin-polarization in the chiral molecules is the key for the observed MR.","['Kouta Kondou', 'Masanobu Shiga', 'Shoya Sakamoto', 'Hiroyuki Inuzuka', 'Atsuko Nihonyanagi', 'Fumito Araoka', 'Masaki Kobayashi', 'Shinji Miwa', 'Daigo Miyajima', 'YoshiChika Otani']",2021-12-16T04:07:48Z,http://arxiv.org/abs/2112.08607v1
Learned Half-Quadratic Splitting Network for MR Image Reconstruction,"Magnetic Resonance (MR) image reconstruction from highly undersampled
$k$-space data is critical in accelerated MR imaging (MRI) techniques. In
recent years, deep learning-based methods have shown great potential in this
task. This paper proposes a learned half-quadratic splitting algorithm for MR
image reconstruction and implements the algorithm in an unrolled deep learning
network architecture. We compare the performance of our proposed method on a
public cardiac MR dataset against DC-CNN and LPDNet, and our method outperforms
other methods in both quantitative results and qualitative results with fewer
model parameters and faster reconstruction speed. Finally, we enlarge our model
to achieve superior reconstruction quality, and the improvement is $1.76$ dB
and $2.74$ dB over LPDNet in peak signal-to-noise ratio on $5\times$ and
$10\times$ acceleration, respectively. Code for our method is publicly
available at https://github.com/hellopipu/HQS-Net.","['Bingyu Xin', 'Timothy S. Phan', 'Leon Axel', 'Dimitris N. Metaxas']",2021-12-17T20:48:21Z,http://arxiv.org/abs/2112.09760v3
"Nonreciprocal Nature and induced Tunneling Barrier Modulation in Chiral
  Molecular Devices","The chirality-spin interaction is a fascinating topic for physicists and
chemists. For example, chiral molecules like DNA generate giant spin
polarization in nanodevices characterized by large magnetoresistance (MR). This
phenomenon, called chirality-induced spin selectivity (CISS), paves pathways
for unconventional spintronic devices and enantiomer separation. Different from
ordinary transport, CISS MR violates Onsager's reciprocal relation and its
physical mechanism is elusive and debated. In this work, we propose that the
CISS MR is intimately related to the electric magnetochiral anisotropy (EMCA)
while EMCA respects Onsager's relation. EMCA generates extra charge trapping in
the device and modifies the electron tunneling barrier that alters the
tunneling resistance sensitively, circumventing the Onsager's reciprocity. Our
theory reveals the intimate connection between EMCA and CISS MR and explains
the unusually large MR ratio by the nonlinear tunneling transport, which is
related to the induced spin polarization indirectly. We provide a tunneling
barrier model to extract the barrier modulation from available experimental
results. Our work provides a deep understanding of the CISS transport by
characterizing the tunneling barrier and further linking it to another quantity
measured in recent experiments, the surface potential.","['Jiewen Xiao', 'Yufei Zhao', 'Binghai Yan']",2022-01-10T20:10:14Z,http://arxiv.org/abs/2201.03623v3
Biochemical Space Language in Relation to Multiset Rewriting Systems,"This technical report relates Biochemical Space Language (BCSL) to Multiset
rewriting systems (MRS). For a BCSL model, the semantics are defined in terms
of transition systems, while for an MRS, they are defined in terms of a set of
runs. In this report, we relate BCSL to MRS by first showing how the transition
system is related to a set of runs and consequently showing how for every BCSL
model, an MRS can be constructed such that both represent the same set of runs.
The motivation of this step is to establish BCSL in the context of a more
general rewriting system and benefit from properties shown for them. Finally,
we show that regulations defined for MRS can be consequently used in the BCSL
model.","['Matej Troják', 'David Šafránek', 'Luboš Brim']",2022-01-12T15:08:36Z,http://arxiv.org/abs/2201.08817v1
"Mushroom-instability-driven Magnetic Reconnections in Collisionless
  Relativistic Jets","We study the kinetic plasma dynamics in collisionless relativistic jets with
velocity shear, by carrying out particle-in-cell simulations in the transverse
plane of a jet. It is discovered that intermittent magnetic reconnections (MRs)
are driven by Mushroom instability (MI), which is an important kinetic-scale
plasma instability in the plasma shear-flows with relativistic bulk speed. We
refer to this sequence of kinetic plasma phenomena as ""MI-driven MR"". The
MI-driven MRs intermittently occur with moving the location of the reconnection
points from the vicinity of the initial velocity-shear surface towards the
center of the jet. As a consequence, the number density of high energy
electrons, which are accelerated by MI-driven MRs, increases with time in the
region inside the initial velocity-shear surface with accompanying the
generation and subsequent amplification of magnetic fields by MI. The maximum
Lorentz factor of electrons increases with initial bulk Lorentz factor of the
jet. A possible relation of MI-driven MR to the bright synchrotron emission in
jet-spine of active galactic nucleus jets is also discussed.","['Tomohisa Kawashima', 'Seiji Ishiguro', 'Toseo Moritaka', 'Ritoku Horiuchi', 'Kohji Tomisaka']",2022-02-20T01:22:16Z,http://arxiv.org/abs/2202.09706v1
Cross-Modality High-Frequency Transformer for MR Image Super-Resolution,"Improving the resolution of magnetic resonance (MR) image data is critical to
computer-aided diagnosis and brain function analysis. Higher resolution helps
to capture more detailed content, but typically induces to lower
signal-to-noise ratio and longer scanning time. To this end, MR image
super-resolution has become a widely-interested topic in recent times. Existing
works establish extensive deep models with the conventional architectures based
on convolutional neural networks (CNN). In this work, to further advance this
research field, we make an early effort to build a Transformer-based MR image
super-resolution framework, with careful designs on exploring valuable domain
prior knowledge. Specifically, we consider two-fold domain priors including the
high-frequency structure prior and the inter-modality context prior, and
establish a novel Transformer architecture, called Cross-modality
high-frequency Transformer (Cohf-T), to introduce such priors into
super-resolving the low-resolution (LR) MR images. Experiments on two datasets
indicate that Cohf-T achieves new state-of-the-art performance.","['Chaowei Fang', 'Dingwen Zhang', 'Liang Wang', 'Yulun Zhang', 'Lechao Cheng', 'Junwei Han']",2022-03-29T07:56:55Z,http://arxiv.org/abs/2203.15314v2
Deep Learning-Based MR Image Re-parameterization,"Magnetic resonance (MR) image re-parameterization refers to the process of
generating via simulations of an MR image with a new set of MRI scanning
parameters. Different parameter values generate distinct contrast between
different tissues, helping identify pathologic tissue. Typically, more than one
scan is required for diagnosis; however, acquiring repeated scans can be
costly, time-consuming, and difficult for patients. Thus, using MR image
re-parameterization to predict and estimate the contrast in these imaging scans
can be an effective alternative. In this work, we propose a novel deep learning
(DL) based convolutional model for MRI re-parameterization. Based on our
preliminary results, DL-based techniques hold the potential to learn the
non-linearities that govern the re-parameterization.","['Abhijeet Narang', 'Abhigyan Raj', 'Mihaela Pop', 'Mehran Ebrahimi']",2022-06-11T12:39:37Z,http://arxiv.org/abs/2206.05516v2
"Interferometric cavity ring-down technique for ultra-high Q-factor
  microresonators","Microresonators (MRs) are key components in integrated optics. As a result,
the estimation of their energy storage capacity as measured by the quality
factor (Q) is crucial. However, in MR with high/ultra-high Q, the surface-wall
roughness dominates the intrinsic Q and generates a coupling between
counter-propagating modes. This splits the usual sharp single resonance and
makes difficult the use of classical methods to assess Q. Here, we
theoretically show that an interferometric excitation can be exploited in a
Cavity Ring-Down (CRD) method to measure the ultimate Q of a MR. In fact, under
suitable conditions, the resonant doublet merges into a single Lorentzian and
the time dynamics of the MR assumes the usual behavior of a single-mode
resonator unaffected by backscattering. This allows obtaining a typical
exponential decay in the charging and discharging time of the MR, and thus,
estimating its ultimate Q by measuring the photon lifetime.","['Stefano Biasi', 'Riccardo Franchi', 'Lorenzo Pavesi']",2022-06-16T12:36:11Z,http://arxiv.org/abs/2206.08123v1
"Augmented Reality and Mixed Reality Measurement Under Different
  Environments: A Survey on Head-Mounted Devices","Augmented Reality (AR) and Mixed Reality (MR) have been two of the most
explosive research topics in the last few years. Head-Mounted Devices (HMDs)
are essential intermediums for using AR and MR technology, playing an important
role in the research progress in these two areas. Behavioral research with
users is one way of evaluating the technical progress and effectiveness of
HMDs. In addition, AR and MR technology is dependent upon virtual interactions
with the real environment. Thus, conditions in real environments can be a
significant factor for AR and MR measurements with users. In this paper, we
survey 87 environmental-related HMD papers with measurements from users,
spanning over 32 years. We provide a thorough review of AR- and MR-related user
experiments with HMDs under different environmental factors. Then, we summarize
trends in this literature over time using a new classification method with four
environmental factors, the presence or absence of user feedback in behavioral
experiments, and ten main categories to subdivide these papers (e.g., domain
and method of user assessment). We also categorize characteristics of the
behavioral experiments, showing similarities and differences among papers.","['Hung-Jui Guo', 'Jonathan Z. Bakdash', 'Laura R. Marusich', 'Balakrishnan Prabhakaran']",2022-10-29T02:03:56Z,http://arxiv.org/abs/2210.16463v1
Multimodal Recommender Systems: A Survey,"The recommender system (RS) has been an integral toolkit of online services.
They are equipped with various deep learning techniques to model user
preference based on identifier and attribute information. With the emergence of
multimedia services, such as short video, news and etc., understanding these
contents while recommending becomes critical. Besides, multimodal features are
also helpful in alleviating the problem of data sparsity in RS. Thus,
Multimodal Recommender System (MRS) has attracted much attention from both
academia and industry recently. In this paper, we will give a comprehensive
survey of the MRS models, mainly from technical views. First, we conclude the
general procedures and major challenges for MRS. Then, we introduce the
existing MRS models according to three categories, i.e., Feature Interaction,
Feature Enhancement and Model Optimization. To make it convenient for those who
want to research this field, we also summarize the dataset and code resources.
Finally, we discuss some promising future directions of MRS and conclude this
paper.","['Qidong Liu', 'Jiaxi Hu', 'Yutian Xiao', 'Jingtong Gao', 'Xiangyu Zhao']",2023-02-08T05:12:54Z,http://arxiv.org/abs/2302.03883v1
"HoloTouch: Interacting with Mixed Reality Visualizations Through
  Smartphone Proxies","We contribute interaction techniques for augmenting mixed reality (MR)
visualizations with smartphone proxies. By combining head-mounted displays
(HMDs) with mobile touchscreens, we can augment low-resolution holographic 3D
charts with precise touch input, haptics feedback, high-resolution 2D graphics,
and physical manipulation. Our approach aims to complement both MR and physical
visualizations. Most current MR visualizations suffer from unreliable tracking,
low visual resolution, and imprecise input. Data physicalizations on the other
hand, although allowing for natural physical manipulation, are limited in
dynamic and interactive modification. We demonstrate how mobile devices such as
smartphones or tablets can serve as physical proxies for MR data interactions,
creating dynamic visualizations that support precise manipulation and rich
input and output. We describe 6 interaction techniques that leverage the
combined physicality, sensing, and output capabilities of HMDs and smartphones,
and demonstrate those interactions via a prototype system. Based on an
evaluation, we outline opportunities for combining the advantages of both MR
and physical charts.","['Neil Chulpongsatorn', 'Wesley Willett', 'Ryo Suzuki']",2023-03-15T20:19:13Z,http://arxiv.org/abs/2303.08916v1
"A Secure Medical Record Sharing Scheme Based on Blockchain and Two-fold
  Encryption","Usually, a medical record (MR) contains the patients disease-oriented
sensitive information. In addition, the MR needs to be shared among different
bodies, e.g., diagnostic centres, hospitals, physicians, etc. Hence, retaining
the privacy and integrity of MR is crucial. A blockchain based secure MR
sharing system can manage these aspects properly. This paper proposes a
blockchain based electronic (e-) MR sharing scheme that (i) considers the
medical image and the text as the input, (ii) enriches the data privacy through
a two-fold encryption mechanism consisting of an asymmetric cryptosystem and
the dynamic DNA encoding, (iii) assures data integrity by storing the encrypted
e-MR in the distinct block designated for each user in the blockchain, and (iv)
eventually, enables authorized entities to regain the e-MR through decryption.
Preliminary evaluations, analyses, comparisons with state-of-the-art works,
etc., imply the efficacy of the proposed scheme.","['Md. Ahsan Habib', 'Kazi Md. Rokibul Alam', 'Yasuhiko Morimoto']",2023-02-09T06:37:22Z,http://arxiv.org/abs/2304.13511v1
Regular reflection to Mach reflection(RR-MR) transition in Short wedges,"Regular reflection (RR) to Mach reflection(MR) transitions (RR-MR) on long
wedges in steady supersonic flows have been well studied and documented.
However, in a short wedge where the wedge length is small, the transition
prediction becomes really challenging owing to the interaction of the expansion
fan emanating from the trailing edge of the wedge with the incident shock and
the triple/reflection point. The extent of this interaction depends on the
distance between the wedge trailing edge and the symmetry line (Ht). This
distance is a geometric combination of the distance of the wedge leading edge
from the symmetry line (H), the wedge angle, and the wedge length (w). In the
present work, the RR-MR transitions have been studied using analytical and
computational methods, and the transition lines are plotted for various Mach
numbers and wedge lengths. The transition criterion strongly depends on the
wedge length, which can be so adjusted to eliminate the RR-MR transitions till
the wedge angle reaches the no-reflection domain.","['Vinod Yeldho Baby', 'Vinoth Paramanantham', 'G Rajesh']",2023-06-13T06:40:49Z,http://arxiv.org/abs/2306.07568v2
"FedAutoMRI: Federated Neural Architecture Search for MR Image
  Reconstruction","Centralized training methods have shown promising results in MR image
reconstruction, but privacy concerns arise when gathering data from multiple
institutions. Federated learning, a distributed collaborative training scheme,
can utilize multi-center data without the need to transfer data between
institutions. However, existing federated learning MR image reconstruction
methods rely on manually designed models which have extensive parameters and
suffer from performance degradation when facing heterogeneous data
distributions. To this end, this paper proposes a novel FederAted neUral
archiTecture search approach fOr MR Image reconstruction (FedAutoMRI). The
proposed method utilizes differentiable architecture search to automatically
find the optimal network architecture. In addition, an exponential moving
average method is introduced to improve the robustness of the client model to
address the data heterogeneity issue. To the best of our knowledge, this is the
first work to use federated neural architecture search for MR image
reconstruction. Experimental results demonstrate that our proposed FedAutoMRI
can achieve promising performances while utilizing a lightweight model with
only a small number of model parameters compared to the classical federated
learning methods.","['Ruoyou Wu', 'Cheng Li', 'Juan Zou', 'Shanshan Wang']",2023-07-21T12:34:42Z,http://arxiv.org/abs/2307.11538v1
Variations on the two-child problem,"Mr. Smith has two children. Given that at least one of them is a boy, how
likely is it that Mr. Smith has two boys? It's a very standard puzzle in
elementary books on probability theory. Whoever asks you this question hopes
that you will answer ""$\frac{1}{2}$"", in which case they can say triumphantly
""Oh no, the answer is $\frac{1}{3}$"". This is called the two-child puzzle. Some
authors have discussed a striking variation, which we'll call the Adam puzzle.
Again, Mr. Smith has two children. Given that one of them is a boy named Adam,
how likely is it that Mr. Smith has two boys? Astonishingly, now the answer is
$\frac{1}{2}$, at least approximately. (The exact answer depends a bit on
precise assumptions.) We give pictorial explanations of both puzzles. We then
point out that the answers usually given rely on a tacit assumption about how
the information that one of Mr. Smith's two children is a boy, or one of them
is a boy named Adam, is obtained. We give examples showing that the answers may
be different with different assumptions. We conclude with a discussion of why
the Adam puzzle is so confusing to most people.","['Christoph Börgers', 'Samer Nour Eddine']",2023-08-30T12:45:46Z,http://arxiv.org/abs/2308.16002v1
