title,summary,authors,published,link
"An adaptive multiresolution flux reconstruction method with local time
  stepping and artificial viscosity for compressible flows simulations","In this paper, we introduce a novel approach that combines multiresolution
(MR) techniques with the flux reconstruction (FR) method to accurately and
effciently simulate compressible flows. We achieve further enhancements in
effciency through the incorporation of local time stepping, and we add
artificial viscosity to capture shocks. With the developed MR-FR algorithm, the
layer difference of two adjacent elements can exceed 1, and simulation errors
can be adjusted by manipulating a single scalar. To ensure conservation,
information communication between nodes at different layers is accomplished
using L2 projection. Additionally, we propose an innovative indicator based on
MR analysis to detect discontinuities, enabling us to take full advantage of
the details generated by MR. By indicating smoothness and adding artificial
viscosity only to the finest meshes, computational costs can be reduced and
errors resulting from artificial diffusion can be locally limited. Numerical
tests demonstrate that the adoption of MR preserve the convergence order of the
FR method, and the newly proposed indicator performs well in detecting
discontinuities. Overall, the MR-FR algorithm can accurately simulate
compressible flows with strong shocks and physical dissipation using
significantly fewer grids, making it a promising approach for further
applications.","['Yixuan Lian', 'Jinsheng Cai', 'Shucheng Pan']",2023-06-20T09:03:50Z,http://arxiv.org/abs/2306.11396v1
Can we predict the Most Replayed data of video streaming platforms?,"Predicting which specific parts of a video users will replay is important for
several applications, including targeted advertisement placement on video
platforms and assisting video creators. In this work, we explore whether it is
possible to predict the Most Replayed (MR) data from YouTube videos. To this
end, we curate a large video benchmark, the YTMR500 dataset, which comprises
500 YouTube videos with MR data annotations. We evaluate Deep Learning (DL)
models of varying complexity on our dataset and perform an extensive ablation
study. In addition, we conduct a user study to estimate the human performance
on MR data prediction. Our results show that, although by a narrow margin, all
the evaluated DL models outperform random predictions. Additionally, they
exceed human-level accuracy. This suggests that predicting the MR data is a
difficult task that can be enhanced through the assistance of DL. Finally, we
believe that DL performance on MR data prediction can be further improved, for
example, by using multi-modal learning. We encourage the research community to
use our benchmark dataset to further investigate automatic MR data prediction.","['Alessandro Duico', 'Ombretta Strafforello', 'Jan van Gemert']",2023-09-12T10:08:33Z,http://arxiv.org/abs/2309.06102v1
"Machine Learning for Automated Mitral Regurgitation Detection from
  Cardiac Imaging","Mitral regurgitation (MR) is a heart valve disease with potentially fatal
consequences that can only be forestalled through timely diagnosis and
treatment. Traditional diagnosis methods are expensive, labor-intensive and
require clinical expertise, posing a barrier to screening for MR. To overcome
this impediment, we propose a new semi-supervised model for MR classification
called CUSSP. CUSSP operates on cardiac imaging slices of the 4-chamber view of
the heart. It uses standard computer vision techniques and contrastive models
to learn from large amounts of unlabeled data, in conjunction with specialized
classifiers to establish the first ever automated MR classification system.
Evaluated on a test set of 179 labeled -- 154 non-MR and 25 MR -- sequences,
CUSSP attains an F1 score of 0.69 and a ROC-AUC score of 0.88, setting the
first benchmark result for this new task.","['Ke Xiao', 'Erik Learned-Miller', 'Evangelos Kalogerakis', 'James Priest', 'Madalina Fiterau']",2023-10-07T16:48:24Z,http://arxiv.org/abs/2310.04871v1
"An efficient class of increasingly high-order ENO schemes with
  multi-resolution","We construct an efficient class of increasingly high-order (up to 17th-order)
essentially non-oscillatory schemes with multi-resolution (ENO-MR) for solving
hyperbolic conservation laws. The candidate stencils for constructing ENO-MR
schemes range from first-order one-point stencil increasingly up to the
designed very high-order stencil. The proposed ENO-MR schemes adopt a very
simple and efficient strategy that only requires the computation of the
highest-order derivatives of a part of candidate stencils. Besides simplicity
and high efficiency, ENO-MR schemes are completely parameter-free and
essentially scale-invariant. Theoretical analysis and numerical computations
show that ENO-MR schemes achieve designed high-order convergence in smooth
regions which may contain high-order critical points (local extrema) and retain
ENO property for strong shocks. In addition, ENO-MR schemes could capture
complex flow structures very well.",['Hua Shen'],2023-11-27T03:01:31Z,http://arxiv.org/abs/2311.15504v1
"A Random Effects Model-based Method of Moments Estimation of Causal
  Effect in Mendelian Randomization Studies","Recent advances in genotyping technology have delivered a wealth of genetic
data, which is rapidly advancing our understanding of the underlying genetic
architecture of complex diseases. Mendelian Randomization (MR) leverages such
genetic data to estimate the causal effect of an exposure factor on an outcome
from observational studies. In this paper, we utilize genetic correlations to
summarize information on a large set of genetic variants associated with the
exposure factor. Our proposed approach is a generalization of the MR-inverse
variance weighting (IVW) approach where we can accommodate many weak and
pleiotropic effects. Our approach quantifies the variation explained by all
valid instrumental variables (IVs) instead of estimating the individual effects
and thus could accommodate weak IVs. This is particularly useful for performing
MR estimation in small studies, or minority populations where the selection of
valid IVs is unreliable and thus has a large influence on the MR estimation.
Through simulation and real data analysis, we demonstrate that our approach
provides a robust alternative to the existing MR methods. We illustrate the
robustness of our proposed approach under the violation of MR assumptions and
compare the performance with several existing approaches.","['Wenhao Cao', 'Saonli Basu']",2023-12-18T04:35:30Z,http://arxiv.org/abs/2312.10926v1
"Knowledge-driven deep learning for fast MR imaging: undersampled MR
  image reconstruction from supervised to un-supervised learning","Deep learning (DL) has emerged as a leading approach in accelerating MR
imaging. It employs deep neural networks to extract knowledge from available
datasets and then applies the trained networks to reconstruct accurate images
from limited measurements. Unlike natural image restoration problems, MR
imaging involves physics-based imaging processes, unique data properties, and
diverse imaging tasks. This domain knowledge needs to be integrated with
data-driven approaches. Our review will introduce the significant challenges
faced by such knowledge-driven DL approaches in the context of fast MR imaging
along with several notable solutions, which include learning neural networks
and addressing different imaging application scenarios. The traits and trends
of these techniques have also been given which have shifted from supervised
learning to semi-supervised learning, and finally, to unsupervised learning
methods. In addition, MR vendors' choices of DL reconstruction have been
provided along with some discussions on open questions and future directions,
which are critical for the reliable imaging systems.","['Shanshan Wang', 'Ruoyou Wu', 'Sen Jia', 'Alou Diakite', 'Cheng Li', 'Qiegen Liu', 'Leslie Ying']",2024-02-05T03:37:05Z,http://arxiv.org/abs/2402.02704v1
UniMD: Towards Unifying Moment Retrieval and Temporal Action Detection,"Temporal Action Detection (TAD) focuses on detecting pre-defined actions,
while Moment Retrieval (MR) aims to identify the events described by open-ended
natural language within untrimmed videos. Despite that they focus on different
events, we observe they have a significant connection. For instance, most
descriptions in MR involve multiple actions from TAD. In this paper, we aim to
investigate the potential synergy between TAD and MR. Firstly, we propose a
unified architecture, termed Unified Moment Detection (UniMD), for both TAD and
MR. It transforms the inputs of the two tasks, namely actions for TAD or events
for MR, into a common embedding space, and utilizes two novel query-dependent
decoders to generate a uniform output of classification score and temporal
segments. Secondly, we explore the efficacy of two task fusion learning
approaches, pre-training and co-training, in order to enhance the mutual
benefits between TAD and MR. Extensive experiments demonstrate that the
proposed task fusion learning scheme enables the two tasks to help each other
and outperform the separately trained counterparts. Impressively, UniMD
achieves state-of-the-art results on three paired datasets Ego4D, Charades-STA,
and ActivityNet. Our code will be released at
https://github.com/yingsen1/UniMD.","['Yingsen Zeng', 'Yujie Zhong', 'Chengjian Feng', 'Lin Ma']",2024-04-07T12:14:42Z,http://arxiv.org/abs/2404.04933v1
"Diffusion Schrödinger Bridge Models for High-Quality MR-to-CT
  Synthesis for Head and Neck Proton Treatment Planning","In recent advancements in proton therapy, MR-based treatment planning is
gaining momentum to minimize additional radiation exposure compared to
traditional CT-based methods. This transition highlights the critical need for
accurate MR-to-CT image synthesis, which is essential for precise proton dose
calculations. Our research introduces the Diffusion Schr\""odinger Bridge Models
(DSBM), an innovative approach for high-quality MR-to-CT synthesis. DSBM learns
the nonlinear diffusion processes between MR and CT data distributions. This
method improves upon traditional diffusion models by initiating synthesis from
the prior distribution rather than the Gaussian distribution, enhancing both
generation quality and efficiency. We validated the effectiveness of DSBM on a
head and neck cancer dataset, demonstrating its superiority over traditional
image synthesis methods through both image-level and dosimetric-level
evaluations. The effectiveness of DSBM in MR-based proton treatment planning
highlights its potential as a valuable tool in various clinical scenarios.","['Muheng Li', 'Xia Li', 'Sairos Safai', 'Damien Weber', 'Antony Lomax', 'Ye Zhang']",2024-04-17T20:48:19Z,http://arxiv.org/abs/2404.11741v1
"Efficient Spin-Adapted Implementation of Multireference Algebraic
  Diagrammatic Construction Theory. I. Core-Ionized States and X-Ray
  Photoelectron Spectra","We present an efficient implementation of multireference algebraic
diagrammatic construction theory (MR-ADC) for simulating core-ionized states
and X-ray photoelectron spectra (XPS). Taking advantage of spin adaptation,
automatic code generation, and density fitting, our implementation can perform
calculations for molecules with more than 1500 molecular orbitals,
incorporating static and dynamic correlation in the ground and excited
electronic states. We demonstrate the capabilities of MR-ADC methods by
simulating the XPS spectra of substituted ferrocene complexes and azobenzene
isomers. For the ground electronic states of these molecules, the XPS spectra
computed using the extended second-order MR-ADC method (MR-ADC(2)-X) are in
excellent agreement with available experimental results. We further show that
MR-ADC can be used as a tool for interpreting or predicting the results of
time-resolved XPS measurements by simulating the core ionization spectra of
azobenzene along its photoisomerization, including the XPS signatures of
excited states and the minimum energy conical intersection. This work is the
first in a series of publications reporting the efficient implementations of
MR-ADC methods.","['Carlos E. V. de Moura', 'Alexander Yu. Sokolov']",2024-05-13T20:05:52Z,http://arxiv.org/abs/2405.08161v1
"Opening a new window on MR-based Electrical Properties Tomography with
  deep learning","Electrical properties (EPs) of tissues, conductivity and permittivity, are
modulated by the ionic and water content, which change in presence of
pathologies. Information on tissues EPs can be used e.g. as an endogenous
biomarker in oncology. MR-Electrical Properties Tomography (MR-EPT) aims to
reconstruct tissue EPs by solving an electromagnetic inverse problem relating
MR measurements of the transmit radiofrequency RF field to the EPs. However,
MR-EPT reconstructions highly suffer from noise in the RF field maps, which
limits the clinical applicability. Instead of employing electromagnetic models
posing strict requirements on the measured quantities, we propose a data driven
approach where the inverse transformation is learned by means of a neural
network. Supervised training of a conditional generative adversarial neural
network was performed using simulated realistic RF field maps and realistic
human head dielectric models. Deep learning EPT (DL-EPT) reconstructions are
presented for in-silica MR data and MR measurements at 3 Tesla on phantoms and
human brains. DL-EPT shows high quality EP maps, demonstrating good accuracy
and greatly improved precision compared to conventional MR-EPT. Moreover,
DL-EPT allows permittivity reconstructions at 3 Tesla, which is not possible
with state-of-art MR-EPT techniques. The supervised learning-based approach
leverages the strength of tailored electromagnetic simulations, allowing
inclusion of a priori information (e.g. coil setup) and circumvention of
inaccessible MR electromagnetic quantities. Since DL-EPT is highly
noise-robust, the requirements for MRI data acquisitions can be relaxed,
allowing faster acquisitions and higher resolutions. We believe that DL-EPT
greatly improves the quality and applicability of EPT opening a new window for
an endogenous biomarker in MRI diagnostics that reflects differences in ionic
tissue content.","['Stefano Mandija', 'Ettore F. Meliadò', 'Niek R. F. Huttinga', 'Peter R. Luijten', 'Cornelis A. T. van den Berg']",2018-03-30T18:10:20Z,http://arxiv.org/abs/1804.00016v2
"The impact of MR-guided attenuation correction (compared to CTbased AC)
  on the diagnosis of anosmia based on 99m-Tc EthylCysteinate-Dimer SPECT
  images","99m-Tc Ethyl-Cysteinate-Dimer SPECT and MR imaging play a significant role in
diagnosing anosmia. In this study, two-tissue class and three-tissue class
attenuation maps (2C-MR and 3CMR) obtained from MR images were compared with
CT-based attenuation correction (CTAC). Afterward, the presence of
hypo-perfusion in brain lobes was evaluated in SPECT images. The 2C-MRAC map
was generated through segmentation of T1-W MR images into air and soft-tissue,
while in the 3C-MRAC map, the cortical bone was also considered. For
investigating MRAC approaches, the difference between activity concentration
(ACC) values was estimated in 144 volumes of interest. Ten normal and fourteen
anosmic patients were compared by calculating the average normalized count and
standard uptake value ratio parameters in the brain lobes. The comparison
between attenuation correction strategies represented that MRAC images resulted
in underestimation of the ACC values which was more substantial in the cortical
area rather than in central regions (maximum 9% vs. 6% for 2C-MR and maximum
5.5% vs. 3.5% for 3C-MR). Nevertheless, there was a strong correlation between
the MRAC and CTAC methods with a correlation coefficient of 0.7 for both 2C-MR
and 3C-MR. The statistical analysis between normal and affected groups
indicated the hypoperfusion in the cortex of Lh_frontal, Rh and Lh_temporal
lobes with p-values < 0.05. Using MRAC resulted in underestimation of activity
concentration which was partly eliminated by considering the cortical bone in
the 3C-MR attenuation map. Hypo-perfusion was perceived in Frontal and Temporal
lobes in SPECT-MRAC images of the anosmic group.","['Faeze Gholamiankhah', 'Samaneh Mostafapour', 'Seid Kazem Razavi-Ratki', 'Ali Asghar Parach', 'Hossein Arabi']",2021-06-07T15:22:45Z,http://arxiv.org/abs/2106.03712v1
"Geometric distortion and astrometric calibration of the JWST MIRI Medium
  Resolution Spectrometer","The Medium-Resolution integral field Spectrometer (MRS) of MIRI on board JWST
performs spectroscopy between 5 and 28~$\mu$m. The optics of the MRS introduce
substantial distortion, and this needs to be rectified in order to reconstruct
the observed astrophysical scene. We use data from the JWST/MIRI commissioning
and cycle 1 calibration phase, to derive the MRS geometric distortion and
astrometric solution, a critical step in the calibration of MRS data. These
solutions come in the form of transform matrices that map the detector pixels
to spatial coordinates of a local MRS coordinate system called
$\alpha$/$\beta$, to the global JWST observatory coordinates V2/V3. For every
MRS spectral band and each slice dispersed on the detector, the transform of
detector pixels to $\alpha$/$\beta$ is fit by a two-dimensional polynomial,
using a raster of point source observations. A polynomial transform is used to
map the coordinates from $\alpha$/$\beta$ to V2/V3. We calibrated the
distortion of all 198 discrete slices of the MIRI/MRS IFUs, and derived an
updated Field of View (FoV) for each MRS spectral band. The precision of the
distortion solution is estimated to be better than one tenth of a spatial
resolution element, with a root mean square (rms) of 10 milli-arcsecond (mas)
at 5 $\mu$m, to 23 mas at 27 $\mu$m. Finally we find that the wheel positioning
repeatability causes an additional astrometric error of rms 30 mas. We have
demonstrated the MRS astrometric calibration strategy and analysis enabling the
calibration of MRS spectra, a critical step in the data pipeline especially for
science with spatially resolved objects. The distortion calibration was folded
into the JWST pipeline in Calibration Reference Data System (CRDS) context
jwst\_1094.pmap. The distortion calibration precision meets the pre-launch
requirement, and the estimated total astrometric uncertainty is 50 mas.","['P. Patapis', 'I. Argyriou', 'D. R. Law', 'A. M. Glauser', 'A. Glasse', 'A. Labiano', 'J. Álvarez-Márquez', 'P. J. Kavanagh', 'D. Gasman', 'M. Mueller', 'K. Larson', 'B. Vandenbussche', 'P. Klaassen', 'P. Guillard', 'G. S. Wright']",2023-07-03T13:56:23Z,http://arxiv.org/abs/2307.01025v1
"Spin reorientation and in-plane magnetoresistance of lightly doped
  La_{2-x}Sr_{x}CuO_{4} in magnetic fields up to 55 T","The magnetoresistance (MR) in the in-plane resistivity is measured in
magnetic fields up to 55 T in lightly doped La_{2-x}Sr_{x}CuO_{4} in the N\'eel
state (x = 0.01) and in the spin-glass state (x = 0.03) using high-quality
untwinned single crystals. In both cases, a large negative MR is observed to
appear when the magnetic order is established. For x = 0.01, it is found that
the MR is indicative of a one-step transition into a high-field
weak-ferromagnetic state at around 20 T when the magnetic field is applied from
the spin easy axis (b axis), which means that there is no spin-flop transition
in the N\'eel state of this material; this is contrary to a previous report,
but is natural in light of the peculiar in-plane magnetic susceptibility
anisotropy recently found in this system. In the spin-glass state, we observe
that the large (up to \sim20%) negative MR saturates at around 40 T, and this
MR is found to be essentially isotropic when the magnetic field is rotated
within the ab plane. Our data show that the large negative MR is inherent to
LSCO in a magnetically ordered state, in which the weak-ferromagnetic (WF)
moment becomes well-defined; we discuss that the observed MR is essentially due
to the reorientation of the WF moments towards the magnetic field direction
both in the N\'eel state and in the spin-glass state.","['S. Ono', 'Seiki Komiya', 'A. N. Lavrov', 'Yoichi Ando', 'F. F. Balakirev', 'J. B. Betts', 'G. S. Boebinger']",2004-08-27T11:53:52Z,http://arxiv.org/abs/cond-mat/0408604v1
"Magnetoresistance Effects in SrFeO(3-x): Dependence on Phase Composition
  and Relation to Magnetic and Charge Order","Single crystals of iron(IV) rich oxides SrFeO(3-x) with controlled oxygen
content have been studied by Moessbauer spectroscopy, magnetometry,
magnetotransport measurements, Raman spectroscopy, and infrared ellipsometry in
order to relate the large magnetoresistance (MR) effects in this system to
phase composition, magnetic and charge order. It is shown that three different
types of MR effects occur. In cubic SrFeO3 (x = 0) a large negative MR of 25%
at 9 T is associated with a hitherto unknown 60 K magnetic transition and a
subsequent drop in resistivity. The 60 K transition appears in addition to the
onset of helical ordering at ~130 K. In crystals with vacancy-ordered
tetragonal SrFeO(3-x) as majority phase (x ~0.15) a coincident
charge/antiferromagnetic ordering transition near 70 K gives rise to a negative
giant MR effect of 90% at 9 T. A positive MR effect is observed in tetragonal
and orthorhombic materials with increased oxygen deficiency (x = 0.19, 0.23)
which are insulating at low temperatures. Phase mixtures can result in a
complex superposition of these different MR phenomena. The MR effects in
SrFeO(3-x) differ from those in manganites as no ferromagnetic states are
involved.","['P. Adler', 'A. Lebon', 'V. Damljanovic', 'C. Ulrich', 'C. Bernhard', 'A. V. Boris', 'A. Maljuk', 'C. T. Lin', 'B. Keimer']",2005-12-20T15:56:57Z,http://arxiv.org/abs/cond-mat/0512510v1
Point-contact search for antiferromagnetic giant magnetoresistance,"We report the first measurements of effects of large current densities on
current-perpendicular-to-plane magnetoresistance (MR) of magnetic multilayers
containing two antiferromagnetic layers separated by a non-magnetic layer.
These measurements were intended to search for a recently predicted
antiferromagnetic giant magnetoresistance (AGMR) similar to GMR seen in
multilayers containing two ferromagnetic layers separated by a non-magnetic
layer. We report on MR measurements for current injected from point contacts
into sandwiches containing different combinations of layers of F = CoFe and AFM
= FeMn. In addition to: AFM/N/AFM, F/AFM/N/AFM, and F/AFM/N/AFM/F structures,
initial results led us to examine also AFM/F/N/AFM, F/AFM, and single F- and
AFM-layer structures. At low currents, no MR was observed in any samples, and
no MR was observed at any current densities in samples containing only AFMs.
Together, these results indicate that no AGMR is present in these samples. In
samples containing F-layers, high current densities sometimes produced a small
positive MR - largest resistance at high fields. For a given contact
resistance, this MR was usually larger for thicker F-layers, and for a given
current, it was usually larger for larger contact resistances (smaller
contacts). We tentatively attribute this positive MR to suppression at high
currents of spin accumulation induced around and within the F-layers.","['Z. Wei', 'A. Sharma', 'J. Bass', 'M. Tsoi']",2007-11-01T04:18:01Z,http://arxiv.org/abs/0711.0059v3
"Magnetoresistance behavior of a ferromagnetic shape memory alloy:
  Ni_1.75Mn_1.25Ga","A negative-positive-negative switching behavior of magnetoresistance (MR)
with temperature is observed in a ferromagnetic shape memory alloy
Ni_1.75Mn_1.25Ga. In the austenitic phase between 300 and 120 K, MR is negative
due to s-d scattering. Curiously, below 120K MR is positive, while at still
lower temperatures in the martensitic phase, MR is negative again. The positive
MR cannot be explained by Lorentz contribution and is related to a magnetic
transition. Evidence for this is obtained from ab initio density functional
theory, a decrease in magnetization and resistivity upturn at 120 K. Theory
shows that a ferrimagnetic state with anti-ferromagnetic alignment between the
local magnetic moments of the Mn atoms is the energetically favoured ground
state. In the martensitic phase, there are two competing factors that govern
the MR behavior: a dominant negative trend up to the saturation field due to
the decrease of electron scattering at twin and domain boundaries; and a weaker
positive trend due to the ferrimagnetic nature of the magnetic state. MR
exhibits a hysteresis between heating and cooling that is related to the first
order nature of the martensitic phase transition.","['S. Banik', 'R. Rawat', 'P. K. Mukhopadhyay', 'B. L. Ahuja', 'Aparna Chakrabarti', 'P. L. Paulose', 'S. Singh', 'A. K. Singh', 'D. Pandey', 'S. R. Barman']",2008-02-13T11:07:55Z,http://arxiv.org/abs/0802.1801v2
